### ISSUE TITLE
Summon does not fetch all Variables (limit 103-109)

### ISSUE THREAD

**Issue by kb-med** [cyberark/summon#258]
## Summary

I'm testing summon-conjur provider to use as way to inject secrets and environment variables into sveltkit application build process. 
Application is developed by multiple teams and require a lot injected secrets and env VARs (around 160), runnning summon with conjur provider gets between 104 to 109 of them fetched. 

## Steps to Reproduce

1. Create policy which will create 160 or more variables in conjur
2. Prepare secrets.yml insert file which will map thos variables to keys with prefix "SUTEST_"
3. Run summon to fetch values
```
summon --provider summon-conjur env | grep -E 'SUTEST' | wc -l
```

## Expected Results

Fetching all variables and count should be equal to number of variables in insert file secrets.yml

## Actual Results

You will get inconsistent numbers command results range between 103-109

## Reproducible

   * [x] Always 
   * [ ] Sometimes
   * [ ] Non-Reproducible
   
## Version/Tag number

Conjur CLI version 8.1.1-e0849b4
summon version 0.10.4-3d6bc8f
summon-conjur version 0.8.0-4ea17d4

## Environment setup
#ENV1
Localy over terminal 
OS: MacOS Sequoia 15.5

#ENV2
CI with Github Actions
OS: Red Hat Enterprise Linux 9.6 (Plow)
EC2 AWS as Enterprise Github runner 

## Additional Information

*Add any other context about the problem here.*

**Comment by szh** [comment]
Thank you for the report. We're looking into it right now.

**Comment by kb-med** [comment]
Hi @szh,
Unfortunately I see same symptoms with version summon version 0.10.5-3b41730.
Not only we have a lot of values many of them are long strings 86 characters.

I suspect it may be some memory allocation issues as every time we are getting slightly different list of items, both in terms of length and listed values.
Can you please arrange testing and use large strings imitating API keys, long passwords etc.?

**Comment by szh** [comment]
@kb-med, I'm unfortunately unable to reproduce the issue on my machine. Are you able to put together a Docker compose environment with scripts to reproduce the whole environment end to end? You can use the cyberark/conjur and cyberark/conjur-cli Docker images to set up a Conjur OSS instance and use an Ubuntu or other OS image to install summon and summon-conjur. https://github.com/cyberark/summon-conjur/blob/main/docker-compose.yml may be a good start.

**Comment by kb-med** [comment]
> > it works completely fine with summon version 0.10.1
> 
> That's interesting. Same versions of summon-conjur?

his setup is 
Conjur CLI version 8.0.18-4084447
summon version 0.10.1-29ebeaa
summon-conjur version 0.8.0-4ea17d4

mine
Conjur CLI version 8.1.2-556d4a2
summon version 0.10.5-3b41730
summon-conjur version 0.8.0-4ea17d4

**Comment by szh** [comment]
Unfortunately I'm unable to reproduce this issue. I'm going to close the issue but if you're able to find any more details that might help explain what's going on, I'm happy to revisit. Also, you're more than welcome to clone this summon and summon-conjur repositories and try running them from source and attempt to debug it yourself. We're always excited to get community PRs :)

**Comment by szh** [comment]
Alright, try now with summon-conjur [v0.8.1](https://github.com/cyberark/summon-conjur/releases/tag/v0.8.1). You can either set the environment variable `CONJUR_HTTP_TIMEOUT` or update your .conjurrc file to add a line `http_timeout: 600` or some other integer value of seconds. The max is 600.

**Comment by kb-med** [comment]
By running simple bash script to fetch each value one by one it works fine all responses are 200 and no errors

**Comment by szh** [comment]
Very interesting. Are any of the queries taking longer than 60s?

**Comment by kb-med** [comment]
Seems that issue on Github runners is resolved by attaching them to much closer read replica for them.
I still try to investigate my local machine problems

**Comment by kb-med** [comment]
TCP Dump seems that client is sending RESET flag

```Transmission Control Protocol, Src Port: 58729, Dst Port: 443, Seq: 124265, Len: 0

    Source Port: 58729

    Destination Port: 443

    [Stream index: 0]

    [Stream Packet Number: 353]

    [Conversation completeness: Complete, WITH_DATA (63)]

        ..1. .... = RST: Present

        ...1 .... = FIN: Present

        .... 1... = Data: Present

        .... .1.. = ACK: Present

        .... ..1. = SYN-ACK: Present

        .... ...1 = SYN: Present

        [Completeness Flags: RFDASS]

    [TCP Segment Len: 0]

    Sequence Number: 124265    (relative sequence number)

    Sequence Number (raw): 957481264

    [Next Sequence Number: 124265    (relative sequence number)]

    Acknowledgment Number: 0

    Acknowledgment number (raw): 0

    0101 .... = Header Length: 20 bytes (5)

    Flags: 0x004 (RST)

        000. .... .... = Reserved: Not set

        ...0 .... .... = Accurate ECN: Not set

        .... 0... .... = Congestion Window Reduced: Not set

        .... .0.. .... = ECN-Echo: Not set

        .... ..0. .... = Urgent: Not set

        .... ...0 .... = Acknowledgment: Not set

        .... .... 0... = Push: Not set

        .... .... .1.. = Reset: Set

        .... .... ..0. = Syn: Not set

        .... .... ...0 = Fin: Not set

        [TCP Flags: ·········R··]

    Window: 0

    [Calculated window size: 0]

    [Window size scaling factor: 64]

    Checksum: 0x7363 [unverified]

    [Checksum Status: Unverified]

    Urgent Pointer: 0

    [Timestamps]

        [Time since first frame in this TCP stream: 9.817384000 seconds]

        [Time since previous frame in this TCP stream: 0.000138000 seconds]

 
Flags: 0x004 (RST)

    000. .... .... = Reserved: Not set

    ...0 .... .... = Accurate ECN: Not set

    .... 0... .... = Congestion Window Reduced: Not set

    .... .0.. .... = ECN-Echo: Not set

    .... ..0. .... = Urgent: Not set

    .... ...0 .... = Acknowledgment: Not set

    .... .... 0... = Push: Not set

    .... .... .1.. = Reset: Set

    .... .... ..0. = Syn: Not set

    .... .... ...0 = Fin: Not set

    [TCP Flags: ·········R··]

 
```

**Comment by szh** [comment]
@arnauvc what version of summon and summon-conjur do you have (`summon -V`)?

**Comment by arnauvc** [comment]
I've just upgraded to the latest version of both summon and summon-conjur:

summon version 0.10.8-444978f
summon-conjur version 0.9.2-973635e

But results are the same:

EUR to EUR: ✅
```
$ time summon env | wc -l
196

real    0m2.223s
user    0m0.011s
sys     0m0.009s

```

EUR to NAM: ❌
```
$ time summon env | wc -l
127

real    0m10.010s
user    0m0.013s
sys     0m0.005s
```

Here's the .conjurrc

```
$ cat .conjurrc
account: *******
appliance_url: https://**************.com
cert_file: /home/ec2-user/conjur-server.pem
environment: self-hosted
http_timeout: 600
```

**Comment by szh** [comment]
Alright, no problem. I'll get this fixed up :)

**Comment by arnauvc** [comment]
Yes! It's working for me now :) Thanks @szh
